{
  "schema_id": "asklegal.hk-cases.semantic-materiality-case-result",
  "schema_version": "1.0.0",
  "fixture_id": "HKCASE-PROP-SEM-MAT-016",
  "result": {
    "schema_id": "asklegal.hk-cases.semantic-materiality-evaluation-result",
    "schema_version": "1.0.0",
    "rule_id": "HKCASE-PROP-SEM-MATERIALITY-EVALUATOR-001",
    "request_fingerprint": "sha256:f5b54b05c2306cf27455084ddac89c7c48dc30bc57bc5ab433b41673e99b7824",
    "reference_map_fingerprint": "sha256:832b447d8bca20ad6bc2b5787dc77b3cbf321ed9cecd8836ea06ebb66a3ab63d",
    "outcome": "PASS",
    "reasons": [
      "PASS"
    ],
    "required_proposition_count": 1,
    "observed_proposition_count": 1,
    "matched_proposition_count": 1,
    "missing_reference_proposition_ids": [],
    "unsupported_candidate_ids": [],
    "complete_unit_count": 3,
    "provider_calls_authorized": 0,
    "workflow_admission_created": false,
    "search_records_created": 0,
    "release_eligible": false,
    "external_effects": "NONE"
  },
  "provider_calls_authorized": 0,
  "workflow_admissions_created": 0,
  "search_records_created": 0,
  "release_eligible": false,
  "external_effects": "NONE"
}
